sheet,row,context_above,context_row
Vocabulary Scope and Sequence,87,"Grade 8, Unit 1 | Grade 8, Unit 1, Module 1 | Module 1: Word Relationships and Word Meaning | | Build Your Vocabulary: Map a Word Best Practices: Word Toss and Definition | Claim, Evidence, Reasoning, Counterargument, Audience, Debatable, Precise, Supportable, Reason, Personal Narrative, Relevant, Specific, Accurate, Quote, Paraphrase, Summarize, Analyze, Explicit, Theme, Author's Message, Univers","| Grade 8, Unit 1, Module 2 | Module 2: Word Origins and Etymology and Word Meaning | | Build Your Vocabulary: Map a Word Best Practices: List, Group, Label | | | | CCSS.L.8.6; CCSS.SL.8.1; CCSS.L.8.5.B; CCSS.L.8.5.C | | 812.0 | Build Your Vocabulary812"
Writing Scope and Sequence,145,"| Grade 8, Unit 1, Module 1 | Module 1: Show and Tell: Citing Evidence; Supporting Claims About Literary Texts with Evidence | | Writing Process: Quick Journal, Connect, Analyze, Develop, Draft, Review Sharpen Your Sentences: Expand the Sentence Appreciate the Author's Craft | Draft, Review | | Complementary Prompt—Argumentative: Which life lesson that the narrator learns from her interaction with","| Grade 8, Unit 1, Module 2 | Module 2: Show and Tell: Conveying Themes | Organizing Narrative Writing | Writing Process: Quick Journal, Connect, Analyze, Develop, Draft, Review Appreciate the Author's Craft | Draft, Review | | Complementary Prompt—Narrative: For this narrative prompt, inspired by James Bird’s “I Am the Greatest,” explore the question: “What might failure teach us that success can"
Reading Scope and Sequence,115,"Grade 8, Unit 1, Module 1 | Topic Overview; Read; Check; Analyze; Citing Evidence to Write about Literary Texts | Share Your Reflections; Apply Your Learning: Citing Evidence to Write About Literary Texts | Module 1: Marigolds | CCSS.RL.8.1; CCSS.RL.8.2; CCSS.RL.8.4; CCSS.RI.8.4; CCSS.RI.8.10; CCSS.CCRA.R.1; CCSS.CCRA.R.1","Grade 8, Unit 1, Module 2 | Topic Overview; Read; Check; Analyze; Determining Theme and Author's Message in a Personal Narrative | Share Your Reflections; Apply Your Learning: Determining Theme and Author’s Message in a Personal Narrative; | Module 2: I Am the Greatest | CCSS.RL.8.2; CCSS.RL.8.1; CCSS.RL.8.3; CCSS.RL.8.4; CCSS.RL.8.4; CCSS.RI.8.4; CCSS.RI.8.10; CCSS.CCRA.R.1; CCSS.CCRA.R.2; CCSS.R"
Speaking and Listening Scope an,130,"Grade 8, Unit 1, Module 1 | | Module 1: Quick Journal, Share Your Personal Connection: Think-Pair-Share; Share Your Reflections; Apply Your Learning, Share Your Plan | Introducing the Toolkit: Peer Collaboration Using Evidence to Build on Others' Ideas Pose and Respond to Questions | CCSS.SL.8.1; CCSS.SL.8.1.a; CCSS.SL.8.1.b; CCSS.SL.8.1.c; CCSS.SL.8.1.d","Grade 8, Unit 1, Module 2 | | Module 2: Quick Journal, Share Your Personal Connection: Think-Pair-Share; Share Your Reflections; Apply Your Learning, Share Your Plan | Peer Collaboration Using Evidence to Build on Others' Ideas Pose and Respond to Questions | CCSS.SL.8.1; CCSS.SL.8.1.a; CCSS.SL.8.1.b; CCSS.SL.8.1.c; CCSS.SL.8.1.d"
Grammar Scope and Sequence,78,"| Grade 8, Unit 1, Module 1 | Module 1: Verbals | Verbs | Write to Impress: Use Verbals in Sentences | Tense | Share Your Best Writing Sample: Verbs | CCSS.L.8.1.a | 811.0 | Write to Impress: Use Verbals in Sentences 811","| Grade 8, Unit 1, Module 2 | Module 2: Active vs. Passive Verbs | | Write to Impress: Understand Active vs. Passive Verbs: Quill: Active Voice | Active Versus Passive Voice | Share Your Best Writing Sample: Verbs | CCSS.L.8.1.a | 812.0 | Write to Impress: Understand Active vs. Passive Verbs: Quill: Active Voice812"
